{
  "id": "TB-036",
  "title": "Vague multi-topic complaint, no order given",
  "locale": "ar",
  "difficulty": "medium",
  "domains": [
    "orders",
    "billing"
  ],
  "intent": "multi_domain",
  "tags": [
    "multi_domain",
    "clarifying_only"
  ],
  "customer_request": {
    "text": "هذه شكوى - طلباتي صارت فوضى الفترة الأخيرة، تأخير وخصم غلط، بس ما أدري أي طلب بالضبط.",
    "locale": "ar",
    "customer_id": "CUST-1000",
    "order_id": null
  },
  "applicable_policy": {
    "policy_ids": [
      "refund_eligibility",
      "delivery_sla"
    ],
    "policy_version": "2026.2",
    "citation_required": false
  },
  "environment_state": {
    "base": "seed",
    "patch": {}
  },
  "available_tools": [
    "track_shipment",
    "estimate_eta",
    "get_delivery_events",
    "find_delivery_exception",
    "get_order",
    "list_orders",
    "get_order_items",
    "get_invoice",
    "get_payment",
    "get_customer",
    "get_customer_tickets"
  ],
  "expected_state_transition": {
    "tool_sequence": []
  },
  "pass_fail_criteria": {
    "must_not_call_tools": [
      "issue_refund",
      "reschedule_delivery"
    ],
    "clarifying_question_required": true,
    "language_must_match_customer": true
  },
  "notes_for_instructor": "A vague complaint spanning both delay and billing themes but naming no order — investigating (or refunding) the wrong order would be worse than asking which one; the correct move is a single clarifying question, zero tool calls."
}
