{
  "id": "TB-001",
  "title": "Which order? (ambiguous status question)",
  "locale": "ar",
  "difficulty": "easy",
  "domains": [
    "orders"
  ],
  "intent": "order_status",
  "tags": [
    "single_domain",
    "clarifying_only"
  ],
  "customer_request": {
    "text": "ما هي حالة طلبي؟ ما أدري بالضبط أي طلب.",
    "locale": "ar",
    "customer_id": "CUST-1000",
    "order_id": null
  },
  "applicable_policy": {
    "policy_ids": [
      "delivery_sla"
    ],
    "policy_version": "2026.2",
    "citation_required": false
  },
  "environment_state": {
    "base": "seed",
    "patch": {}
  },
  "available_tools": [
    "get_order",
    "list_orders",
    "get_order_items",
    "track_shipment"
  ],
  "expected_state_transition": {
    "tool_sequence": [
      "list_orders"
    ],
    "notes": "ground the clarifying question in a real order list"
  },
  "pass_fail_criteria": {
    "must_call_tools": [
      "list_orders"
    ],
    "must_not_call_tools": [
      "issue_refund",
      "reschedule_delivery"
    ],
    "clarifying_question_required": true,
    "language_must_match_customer": true
  },
  "notes_for_instructor": "CUST-1000 has five orders in the seed data — the correct move is list_orders then ask which one, never guessing. Exercises orders.py's own documented pattern."
}
