{
  "id": "TB-005",
  "title": "Order not found",
  "locale": "ar",
  "difficulty": "easy",
  "domains": [
    "orders",
    "logistics"
  ],
  "intent": "order_status",
  "tags": [
    "error_handling"
  ],
  "customer_request": {
    "text": "هل يمكنك التحقق من حالة الطلب TW-2026-00042؟",
    "locale": "ar",
    "customer_id": "CUST-1068",
    "order_id": "TW-2026-00042"
  },
  "applicable_policy": {
    "policy_ids": [
      "delivery_sla"
    ],
    "policy_version": "2026.2",
    "citation_required": false
  },
  "environment_state": {
    "base": "seed",
    "patch": {}
  },
  "available_tools": [
    "get_order",
    "list_orders",
    "get_order_items",
    "track_shipment"
  ],
  "expected_state_transition": {
    "tool_sequence": [
      "track_shipment"
    ]
  },
  "pass_fail_criteria": {
    "must_call_tools": [
      "track_shipment"
    ],
    "must_not_mention": [
      "500",
      "5000"
    ],
    "language_must_match_customer": true
  },
  "notes_for_instructor": "TW-2026-00042 does not exist in the seed data (order ids in range 10000-99999). The tool returns {\"error\": \"order_not_found\"} as a VALUE — the agent must surface this gracefully, not crash or fabricate a status."
}
